Structure,Molecule name,CAS,SMILES,ID_base,,ID_asignado,ID_concatenado,DB source,DB soubsource,Risk assessment class,Human eco,Species,Exposure route,Standard value,LD50,LD50 units,MM (g/mol),Operación,pLD50,Mode of action,Data Base source reference
,2-aminobutane,,CCC(C)N,6,,1,1_PPDB,PPDB,,acute,,rat,oral,=,350,mg/kg,73.1383,0.0048,2.3201,Fumigant,
,Ammonium carbonate,,C(=O)([O-])[O-].[NH4+].[NH4+],33,,#¡REF!,4_PPDB,PPDB,,acute,,rat,oral,=,2150,mg/kg,96.0855,0.0224,1.6502,"As a fungicide it is a protectant, inhibiting fungal spores and pathogens from entering the host tissues",
,Anilazine (Ref: ENT 26 058),,C1=CC=C(C(=C1)NC2=NC(=NC(=N2)Cl)Cl)Cl,39,,#¡REF!,5_PPDB,PPDB,,acute,,rat,oral,=,4570,mg/kg,275.526,0.0166,1.7802,"Non-systemic with protective action, enzyme inhibitor. Multi-site activity.",
,Anthracene oil,,C1=CC=C2C=C3C=CC=CC3=CC2=C1,40,,#¡REF!,6_PPDB,PPDB,,acute,,rat,oral,=,1955,mg/kg,178.233,0.0110,1.9598,Contact action,
,Azaconazole,,C1COC(O1)(CN2C=NC=N2)C3=C(C=C(C=C3)Cl)Cl,45,,#¡REF!,7_PPDB,PPDB,,acute,,rat,oral,=,308,mg/kg,300.144,0.0010,2.9888,Sterol biosynthesis inhibitor,
,Benalaxyl (Ref: M 9834),,CC1=C(C(=CC=C1)C)N(C(C)C(=O)OC)C(=O)CC2=CC=CC=C2,59,,#¡REF!,9_PPDB,PPDB,,acute,,rat,oral,=,680,mg/kg,325.407,0.0021,2.6799,"Systemic with protective, curative and eradicant action. Disrupts fungal nucleic acid synthesis - RNA ploymerase 1",
,Binapacryl (Ref: FMC 9044),,CCC(C)C1=CC(=CC(=C1OC(=O)C=C(C)C)[N+](=O)[O-])[N+](=O)[O-],79,,#¡REF!,13_PPDB,PPDB,,acute,,rat,oral,=,58,mg/kg,322.316,0.0002,3.7449,"Non-systemic. As a miticide it works with ovicidal action, uncoupling or inhibiting oxidative phosphorylation. Respiration inhibitor.",
,Biphenyl,,C1=CC=C(C=C1)C2=CC=CC=C2,82,,#¡REF!,14_PPDB,PPDB,,acute,,rat,oral,=,2140,mg/kg,154.211,0.0139,1.8577,"Inhibits sporulation, lipid peroxidation",
,Bromuconazole (Ref: LS 860263),,C1C(COC1(CN2C=NC=N2)C3=C(C=C(C=C3)Cl)Cl)Br,97,,#¡REF!,18_PPDB,PPDB,,acute,,rat,oral,=,328,mg/kg,377.068,0.0009,3.0605,Systemic. Sterol biosynthesis inhibitor.,
,Bronopol,,C(C(CO)([N+](=O)[O-])Br)O,98,,#¡REF!,19_PPDB,PPDB,,acute,,rat,oral,=,254,mg/kg,199.988,0.0013,2.8962,Inhibition of dehydrogenase activity causes membrane damage,
,Bupirimate (Ref: PP 588),,CCCCC1=C(N=C(N=C1OS(=O)(=O)N(C)C)NCC)C,99,,#¡REF!,20_PPDB,PPDB,,acute,,rat,oral,=,4000,mg/kg,316.425,0.0126,1.8982,Systemic with curative and protectant action. Nucleic acid synthesis - adenosin-deaminase.,
,Calcium hydroxide,,[OH-].[OH-].[Ca+2],110,,#¡REF!,23_PPDB,PPDB,,acute,,rat,oral,=,7340,mg/kg,74.0919,0.0991,1.0041,"Non-selective, phytotoxic",
,Carboxin (Ref: D 735),,CC1=C(SCCO1)C(=O)NC2=CC=CC=C2,122,,#¡REF!,28_PPDB,PPDB,,acute,,rat,oral,=,2588,mg/kg,235.306,0.0110,1.9587,"Systemic, inhibits mitochondrial function. Succinate Dehydrogenase Inhibitor.",
,Chloroneb,,COC1=CC(=C(C=C1Cl)OC)Cl,145,,#¡REF!,30_PPDB,PPDB,,acute,,rat,oral,=,11000,mg/kg,207.056,0.0531,1.2747,"Systemic, absorbed via rots. Lipid peroxidation inhibitor.",
,Copper II acetate,,CC(=O)[O-].CC(=O)[O-].[Cu+2],172,,#¡REF!,33_PPDB,PPDB,,acute,,rat,oral,=,710,mg/kg,181.634,0.0039,2.4079,"Protective, inhibiting fungal spores and pathogens from entering the host tissues. Multi-site activity.",
,Copper II chloride,,Cl[Cu]Cl,174,,#¡REF!,35_PPDB,PPDB,,acute,,rat,oral,=,140,mg/kg,134.452,0.0010,2.9824,"Protective, inhibiting fungal spores and pathogens from entering the host tissues. Multi-site activity.",
,Copper oxychloride,,O(Cl)Cl.[Cu+2],177,,#¡REF!,38_PPDB,PPDB,,acute,,rat,oral,=,299,mg/kg,150.451,0.0020,2.7017,Absorbed copper disrupts the enzyme systems of pathogens. Multi-site activity.,
,Cymoxanil (Ref: DPX T3217),,CCNC(=O)NC(=O)C(=NOC)C#N,196,,#¡REF!,42_PPDB,PPDB,,acute,,rat,oral,=,356,mg/kg,198.181,0.0018,2.7456,Foliar with protective and curative activity.,
,Dazomet (Ref: N 521),,CN1CN(C(=S)SC1)C,203,,#¡REF!,45_PPDB,PPDB,,acute,,rat,oral,=,415,mg/kg,162.28,0.0026,2.5922,Releases methyl isothiocyanate,
,Dichlorophen,,C1=CC(=C(C=C1Cl)CC2=C(C=CC(=C2)Cl)O)O,217,,#¡REF!,47_PPDB,PPDB,,acute,,rat,oral,=,2690,mg/kg,269.126,0.0100,2.0002,Contact,
,Difenoconazole (Ref: CGA 169374),,CC1COC(O1)(CN2C=NC=N2)C3=C(C=C(C=C3)OC4=CC=C(C=C4)Cl)Cl,230,,#¡REF!,50_PPDB,PPDB,,acute,,rat,oral,=,1453,mg/kg,406.268,0.0036,2.4465,Systemic with preventative and curative action. Disrupts membrane function - inhibition of demethylation during ergosterol synthesis.,
,Difenzoquat (Ref: BAS 450H),,CN1C(=CC(=[N+]1C)C2=CC=CC=C2)C3=CC=CC=C3,232,,#¡REF!,51_PPDB,PPDB,,acute,,rat,oral,=,470,mg/kg,249.336,0.0019,2.7247,"Selective, absorbed by foliage. Acts via the rapid destruction of cell membranes.",
,Dimethirimol (Ref: PP675),,CCCCC1=C(NC(=NC1=O)N(C)C)C,243,,#¡REF!,52_PPDB,PPDB,,acute,,rat,oral,=,2350,mg/kg,209.292,0.0112,1.9497,"Systemic, ergosterol biosynthesis inhibitor. Nucleic acid synthesis - adenosin-deaminase.",
,Dimethomorph (Ref: CME 151),,COC1=C(C=C(C=C1)C(=CC(=O)N2CCOCC2)C3=CC=C(C=C3)Cl)OC,245,,#¡REF!,53_PPDB,PPDB,,acute,,rat,oral,=,3900,mg/kg,387.862,0.0101,1.9976,Systemic with good protective activity. Cellulose synthesis inhibitor.,
,Diniconazole (Ref: XE-779),,CC(C)(C)C(C(=CC1=C(C=C(C=C1)Cl)Cl)N2C=NC=N2)O,247,,#¡REF!,55_PPDB,PPDB,,acute,,rat,oral,=,474,mg/kg,326.226,0.0015,2.8377,Systemic with curative and protective action. Inhibits the demethylation of steroids distrupting ergosterol biosynthesis.,
,Dinobuton (Ref: OMS 1056),,CCC(C)C1=CC(=CC(=C1OC(=O)OC(C)C)[N+](=O)[O-])[N+](=O)[O-],249,,#¡REF!,56_PPDB,PPDB,,acute,,rat,oral,=,140,mg/kg,326.304,0.0004,3.3675,"Non-systemic, rapid contact action. Uncoupler of oxidative phosphorylation via disruption of proton gradient.",
,Dinocap (Ref: ENT 24727),,CCCCCCC(C)C1=CC(=CC(=C1OC(=O)C=CC)[N+](=O)[O-])[N+](=O)[O-],250,,#¡REF!,57_PPDB,PPDB,,acute,,rat,oral,=,1212,mg/kg,364.397,0.0033,2.4781,Contact with protective and curative action. Respiration inhibitor. Uncoupler of oxidative phosphorylation via disruption of proton gradient.,
,Dithianon (Ref: BAS 216F),,C1=CC=C2C(=C1)C(=O)C3=C(C2=O)SC(=C(S3)C#N)C#N,258,,#¡REF!,58_PPDB,PPDB,,acute,,rat,oral,=,300,mg/kg,296.33,0.0010,2.9947,Protectant with some curative activity. Multi-site activity.,
,DNOC (Ref: ENT 154),,CC1=CC(=CC(=C1O)[N+](=O)[O-])[N+](=O)[O-],261,,#¡REF!,59_PPDB,PPDB,,acute,,rat,oral,=,25,mg/kg,198.134,0.0001,3.8990,"Non-systemic, with contact and stomach action. Cell membrane disruption. Uncoupler of oxidative phosphorylation via disruption of proton gradient.",
,Dodine (Ref: BAS 365F),,CCCCCCCCCCCCN=C(N)N.CC(=O)O,263,,#¡REF!,61_PPDB,PPDB,,acute,,rat,oral,=,851,mg/kg,287.446,0.0030,2.5286,Systemic with protectant and eradicant action,
,Epoxiconazole (Ref: BAS 480F),,C1=CC=C(C(=C1)C2C(O2)(CN3C=NC=N3)C4=CC=C(C=C4)F)Cl,267,,#¡REF!,62_PPDB,PPDB,,acute,,rat,oral,=,3160,mg/kg,329.761,0.0096,2.0185,Preventative and curative action. Sterol biosynthesis inhibitor.,
,Ethoxyquin,,CCOC1=CC2=C(C=C1)NC(C=C2C)(C)C,280,,#¡REF!,65_PPDB,PPDB,,acute,,rat,oral,=,1726,mg/kg,217.311,0.0079,2.1000,Anti-oxidant effecting plant growth,
,Fenamidone (Ref: RPA 407213),,CC1(C(=O)N(C(=N1)SC)NC2=CC=CC=C2)C3=CC=CC=C3,289,,#¡REF!,69_PPDB,PPDB,,acute,,rat,oral,=,2028,mg/kg,311.408,0.0065,2.1863,Protective and curative action. Respiration inhibitor (QoL fungicide).,
,Fenpropidin (Ref: CGA 114900),,CC(CC1=CC=C(C=C1)C(C)(C)C)CN2CCCCC2,307,,#¡REF!,75_PPDB,PPDB,,acute,,rat,oral,=,1452,mg/kg,273.462,0.0053,2.2749,Systemic with curative and protective action. Inhibits sterol biosynthesis in membranes.,
,Fenpropimorph (Ref: CGA 101031),,CC1CN(CC(O1)C)CC(C)CC2=CC=C(C=C2)C(C)(C)C,308,,#¡REF!,76_PPDB,PPDB,,acute,,rat,oral,=,1670,mg/kg,303.488,0.0055,2.2594,Systemic with protective and curative action. Disrupts membrane function.,
,Fentin acetate (Ref: OMS 1020),,CC(=O)O[Sn](C1=CC=CC=C1)(C2=CC=CC=C2)C3=CC=CC=C3,311,,#¡REF!,77_PPDB,PPDB,,acute,,rat,oral,=,140,mg/kg,409.071,0.0003,3.4657,Non-systemic with predominate contact activity. Inhibitor of ATP synthase.,
,Fentin hydroxide,,C1=CC=C(C=C1)[Sn](C2=CC=CC=C2)C3=CC=CC=C3.O,312,,#¡REF!,78_PPDB,PPDB,,acute,,rat,oral,=,108,mg/kg,368.042,0.0003,3.5325,Curative and protective action. Inhibitor of ATP synthase.,
,Fluquinconazole (Ref: AE C597265),,C1=CC2=C(C=C1F)C(=O)N(C(=N2)N3C=NC=N3)C4=C(C=C(C=C4)Cl)Cl,342,,#¡REF!,84_PPDB,PPDB,,acute,,rat,oral,=,112,mg/kg,376.178,0.0003,3.5262,Absorbed through foliage. Systemic with protectant and eradicant activity. Disrupts membrane function. Sterol biosynthesis inhibitor.,
,Flusilazole (Ref: DPX H6573),,C[Si](CN1C=NC=N1)(C2=CC=C(C=C2)F)C3=CC=C(C=C3)F,350,,#¡REF!,85_PPDB,PPDB,,acute,,rat,oral,=,674,mg/kg,315.398,0.0021,2.6702,"Broad-spectrum, systemic with protective and curative action. Sterol biosynthesis inhibitor.",
,Flusulfamide (Ref: MTF 651),,C1=CC(=C(C=C1[N+](=O)[O-])Cl)NS(=O)(=O)C2=CC(=C(C=C2)Cl)C(F)(F)F,351,,#¡REF!,86_PPDB,PPDB,,acute,,rat,oral,=,132,mg/kg,415.175,0.0003,3.4977,Inhibits spore germination,
,Furalaxyl (Ref: IPE 134),,CC1=C(C(=CC=C1)C)N(C(C)C(=O)OC)C(=O)C2=CC=CO2,366,,#¡REF!,93_PPDB,PPDB,,acute,,rat,oral,=,940,mg/kg,301.341,0.0031,2.5059,Systemic with protective and curative action. Disrupts fungal nucleic acid synthesis - RNA ploymerase 1,
,Guazatine (Ref: EM 379),,C(CCCCN=C(N)N)CCCNCCCCCCCCN=C(N)N,374,,#¡REF!,95_PPDB,PPDB,,acute,,rat,oral,=,308,mg/kg,355.573,0.0009,3.0624,Inhibition of lipid biosynthesis. Multi-site activity. Broad-spectrum. Protectant,
,Hexachlorophene,,C1=C(C(=C(C(=C1Cl)Cl)CC2=C(C(=CC(=C2Cl)Cl)Cl)O)O)Cl,381,,#¡REF!,97_PPDB,PPDB,,acute,,rat,oral,=,56,mg/kg,406.907,0.0001,3.8613,"Broad-spectrum, topical anti-infective, anti-bacterial agent, neurotoxin",
,Hexaconazole (Ref: PP 523),,CCCCC(CN1C=NC=N1)(C2=C(C=C(C=C2)Cl)Cl)O,382,,#¡REF!,98_PPDB,PPDB,,acute,,rat,oral,=,2189,mg/kg,314.215,0.0070,2.1570,"Broad spectrum, systemic with protective and curative action. Disrupts membrane function. Sterol biosynthesis inhibitor.",
,Hydrogen peroxide,,OO,387,,#¡REF!,99_PPDB,PPDB,,acute,,rat,oral,=,1518,mg/kg,34.0139,0.0446,1.3504,None,
,Hymexazol (Ref: F 319),,CC1=CC(=O)NO1,388,,#¡REF!,100_PPDB,PPDB,,acute,,rat,oral,=,1600,mg/kg,99.0887,0.0161,1.7919,"Systemic, inhibits fungal growth by inhibiting nucleic acid synthesis (DNA / RNA synthesis).",
,Imazalil (Ref: R 023979),,C=CCOC(CN1C=CN=C1)C2=C(C=C(C=C2)Cl)Cl,390,,#¡REF!,101_PPDB,PPDB,,acute,,rat,oral,=,227,mg/kg,297.184,0.0008,3.1170,Systemic with curative and protective properties. Disrupts membrane function.,
,Isoprothiolane (Ref: SS 11946),,CC(C)OC(=O)C(=C1SCCS1)C(=O)OC(C)C,408,,#¡REF!,104_PPDB,PPDB,,acute,,rat,oral,=,1190,mg/kg,290.403,0.0041,2.3875,Systemic with protective and curative action. Phospholipid biosynthesis inhibitor.,
,Mancopper,,C(CNC(=S)[S-])NC(=S)[S-].C(CNC(=S)[S-])NC(=S)[S-].[Mn+2].[Cu+2],423,,#¡REF!,106_PPDB,PPDB,,acute,,rat,oral,=,9600,mg/kg,539.223,0.0178,1.7495,Inhibits the germination of fungal spores. Multi-site activity.,
,Metalaxyl-M (Ref: CGA 329351),,CC1=C(C(=CC=C1)C)N(C(C)C(=O)OC)C(=O)COC,445,,#¡REF!,114_PPDB,PPDB,,acute,,rat,oral,=,375,mg/kg,279.335,0.0013,2.8721,Systemic with curative and protective action. Disrupts fungal nucleic acid synthesis - RNA ploymerase 1.,
,Metam-sodium (Ref: N 869),,CNC(=S)[S-].[Na+],447,,#¡REF!,115_PPDB,PPDB,,acute,,rat,oral,=,896,mg/kg,129.183,0.0069,2.1589,"Soil fumigant, binds to oxygen carrying molecules and prevents tissues from using oxygen. Multi-site activity.",
,Metconazole,,CC1(CCC(C1(CN2C=NC=N2)O)CC3=CC=C(C=C3)Cl)C,451,,#¡REF!,116_PPDB,PPDB,,acute,,rat,oral,=,595,mg/kg,319.835,0.0019,2.7304,"Systemic, ergosterol biosynthesis inhibitor",
,Myclobutanil (Ref: RH 3866),,CCCCC(CN1C=NC=N1)(C#N)C2=CC=C(C=C2)Cl,478,,#¡REF!,120_PPDB,PPDB,,acute,,rat,oral,=,1600,mg/kg,288.781,0.0055,2.2564,"Broad spectrum, systemic with protective, eradicative and curative action. Disrupts membrane function by inhibiting sterol biosynthesis.",
,Nabam,,C(CNC(=S)[S-])NC(=S)[S-].[Na+].[Na+],479,,#¡REF!,121_PPDB,PPDB,,acute,,rat,oral,=,395,mg/kg,256.35,0.0015,2.8122,"Non-specific, exact mode of action is unclear but thought to inhibit protein development.",
,Nuarimol (Ref: EL 228),,C1=CC=C(C(=C1)C(C2=CC=C(C=C2)F)(C3=CN=CN=C3)O)Cl,488,,#¡REF!,122_PPDB,PPDB,,acute,,rat,oral,=,1250,mg/kg,314.746,0.0040,2.4011,Systemic with curative and protective action. Sterol demethylation (ergosterol biosynthesis) inhibitor.,
,Octhilinone (Ref: RH 893),,CCCCCCCCN1C(=O)C=CS1,489,,#¡REF!,123_PPDB,PPDB,,acute,,rat,oral,=,550,mg/kg,213.344,0.0026,2.5887,Inhibits fungal growth by inhibiting nucleic acid synthesis (DNA / RNA synthesis).,
,Ofurace (Ref: AE F057623),,CC1=C(C(=CC=C1)C)N(C2CCOC2=O)C(=O)CCl,490,,#¡REF!,124_PPDB,PPDB,,acute,,rat,oral,=,2600,mg/kg,281.738,0.0092,2.0349,Systemic with curative and protective action. Disrupts fungal nucleic acid synthesis - RNA ploymerase 1.,
,Oxadixyl (Ref: SAN 371F),,CC1=C(C(=CC=C1)C)N(C(=O)COC)N2CCOC2=O,497,,#¡REF!,125_PPDB,PPDB,,acute,,rat,oral,=,1860,mg/kg,278.307,0.0067,2.1750,Systemic with curative and protective action. Disrupts fungal nucleic acid synthesis - RNA ploymerase 1.,
,Oxycarboxin (Ref: F 461),,CC1=C(S(=O)(=O)CCO1)C(=O)NC2=CC=CC=C2,500,,#¡REF!,126_PPDB,PPDB,,acute,,rat,oral,=,1632,mg/kg,267.304,0.0061,2.2143,Systemic with curative action. Inhibition of nucleic acid synthesis. Succinate DeHydrogenase Inhibitor.,
,Paclobutrazol (Ref: PP 333),,CC(C)(C)C(C(CC1=CC=C(C=C1)Cl)N2C=NC=N2)O,504,,#¡REF!,127_PPDB,PPDB,,acute,,rat,oral,=,1336,mg/kg,293.797,0.0045,2.3422,"Absorbed through leaves, stem and roots and translocated",
,Pentachlorophenol,,C1(=C(C(=C(C(=C1Cl)Cl)Cl)Cl)Cl)O,513,,#¡REF!,130_PPDB,PPDB,,acute,,rat,oral,=,80,mg/kg,266.338,0.0003,3.5223,Accelerates aerobic metabolism and increases heat production,
,Prochloraz (Ref: BTS 40542),,CCCN(CCOC1=C(C=C(C=C1Cl)Cl)Cl)C(=O)N2C=CN=C2,536,,#¡REF!,132_PPDB,PPDB,,acute,,rat,oral,=,1023,mg/kg,376.67,0.0027,2.5661,Broad-spectrum with protectant and eradicant properties. Disrupts membrane function.,
,Propiconazole (Ref: CGA 64250),,CCCC1COC(O1)(CN2C=NC=N2)C3=C(C=C(C=C3)Cl)Cl,551,,#¡REF!,135_PPDB,PPDB,,acute,,rat,oral,=,550,mg/kg,342.225,0.0016,2.7939,"Systemic with curative and protective action, works via the demethylation of C-14 during ergosterol biosynthesis",
,Pyrazophos (Ref: HOE 2873),,CCOC(=O)C1=CN2C(=CC(=N2)OP(=S)(OCC)OCC)N=C1C,566,,#¡REF!,140_PPDB,PPDB,,acute,,rat,oral,=,151,mg/kg,373.369,0.0004,3.3932,Systemic with protective and curative action. Phospholipid biosynthesis inhibitor.,
,Pyrifenox (Ref: CGA 179945),,CON=C(CC1=CN=CC=C1)C2=C(C=C(C=C2)Cl)Cl,572,,#¡REF!,141_PPDB,PPDB,,acute,,rat,oral,=,2912,mg/kg,295.168,0.0099,2.0059,Systemic with protective and curative action. Disrupts membrane function.,
,Pyrimethanil (Ref: SN 100309),,CC1=CC(=NC(=N1)NC2=CC=CC=C2)C,573,,#¡REF!,142_PPDB,PPDB,,acute,,rat,oral,=,4150,mg/kg,199.256,0.0208,1.6814,Protective action with some curative properties. Inhibits methionine protein synthesis.,
,Pyroquilon (Ref: CGA 49104),,C1CC(=O)N2CCC3=CC=CC1=C32,575,,#¡REF!,143_PPDB,PPDB,,acute,,rat,oral,=,321,mg/kg,173.214,0.0019,2.7321,"Systemic, melanin biosynthesis inhibitor",
,Sodium carbonate,,C(=O)([O-])[O-].[Na+].[Na+],594,,#¡REF!,147_PPDB,PPDB,,acute,,rat,oral,=,4090,mg/kg,105.988,0.0386,1.4135,Not clear but carbonates appear to damage spore cell wall membranes,
,Spiroxamine (Ref: KWG 4168),,CCCN(CC)CC1COC2(O1)CCC(CC2)C(C)(C)C,599,,#¡REF!,148_PPDB,PPDB,,acute,,rat,oral,=,460,mg/kg,297.481,0.0015,2.8107,"Systemic with protective, curative and eradicative action. Disrupts membrane function. Inhibits sterol biosynthesis in membranes.",
,Tebuconazole (Ref: HWG 1608),,CC(C)(C)C(CCC1=CC=C(C=C1)Cl)(CN2C=NC=N2)O,610,,#¡REF!,150_PPDB,PPDB,,acute,,rat,oral,=,1700,mg/kg,307.824,0.0055,2.2579,"Systemic with protective, curative and eradicant action. Disrupts membrane function. Sterol biosynthesis inhibitor.",
,Tecnazene,,C1=C(C(=C(C(=C1Cl)Cl)[N+](=O)[O-])Cl)Cl,615,,#¡REF!,151_PPDB,PPDB,,acute,,rat,oral,=,1256,mg/kg,260.891,0.0048,2.3175,Protective and curative action. Acts by distrupting membrane structure and function. Lipid peroxidation inhibitor.,
,Tetraconazole (Ref: M 14360),,C1=CC(=C(C=C1Cl)Cl)C(CN2C=NC=N2)COC(C(F)F)(F)F,626,,#¡REF!,152_PPDB,PPDB,,acute,,rat,oral,=,1031,mg/kg,372.148,0.0028,2.5575,"Systemic with protectant, eradicant and curative properties. Sterol biosynthesis inhibitor, acts mainly on the vegetative stages of fungi by blocking the mycelial growth either inside or on the surface of the host plant.",
,Triadimefon,,CC(C)(C)C(=O)C(N1C=NC=N1)OC2=CC=C(C=C2)Cl,648,,#¡REF!,158_PPDB,PPDB,,acute,,rat,oral,=,300,mg/kg,293.753,0.0010,2.9909,"Systemic with protective, curative and eradicant action. Disrupts membrane function. Sterol biosynthesis inhibitor.",
,Triadimenol (Ref: BAY KWG 0519),,CC(C)(C)C(C(N1C=NC=N1)OC2=CC=C(C=C2)Cl)O,649,,#¡REF!,159_PPDB,PPDB,,acute,,rat,oral,=,721,mg/kg,295.769,0.0024,2.6130,"Selective with curative, protective and eradicant action. Disrupts membrane function. Sterol biosynthesis inhibitor.",
,Triazoxide (Ref: SAS 9244),,C1=CC2=C(C=C1Cl)[N+](=NC(=N2)N3C=CN=C3)[O-],654,,#¡REF!,160_PPDB,PPDB,,acute,,rat,oral,=,98,mg/kg,247.645,0.0004,3.4026,"Specific, non-systemic",
,Tricyclazole (Ref: EL 291),,CC1=C2C(=CC=C1)SC3=NN=CN23,660,,#¡REF!,161_PPDB,PPDB,,acute,,rat,oral,=,289.7,mg/kg,189.242,0.0015,2.8151,"Systemic, absorbed by roots and foliage and translocated, used mainly as a protectant, inhibits melanin biosynthesis",
,Tridemorph (Ref: BAS 2205-F),,CCCCCCCCCCCCCN1CC(OC(C1)C)C,661,,#¡REF!,162_PPDB,PPDB,,acute,,rat,oral,=,500,mg/kg,297.525,0.0017,2.7746,"Systemic with eradicant action, absorbed by leaves and shoots, some protectant properties. Disrupts membrane function.",
,Triflumizole (Ref: NF 114 ),,CCCOCC(=NC1=C(C=C(C=C1)Cl)C(F)(F)F)N2C=CN=C2,665,,#¡REF!,164_PPDB,PPDB,,acute,,rat,oral,=,1057,mg/kg,345.751,0.0031,2.5147,Systemic with protective and curative action. Inhibitors of chitin biosynthesis.,
,Ziram,,CN(C)C(=S)[S-].CN(C)C(=S)[S-].[Zn+2],684,,#¡REF!,169_PPDB,PPDB,,acute,,rat,oral,=,267,mg/kg,305.829,0.0009,3.0590,Contact action with protective properties. Multi-site activity.,
,Ferimzone (Ref: TF-164),,CC1=CC=CC=C1C(=NNC2=NC(=CC(=N2)C)C)C,719,,#¡REF!,172_PPDB,PPDB,,acute,,rat,oral,=,725,mg/kg,254.336,0.0029,2.5451,Disrupts membrane function. Thought to inhibit mycelial growth and spore germination.,
,Etem,,C1CN2C(=N1)SSC2=S,875,,#¡REF!,174_PPDB,PPDB,,acute,,rat,oral,=,240,mg/kg,176.288,0.0014,2.8660,Contact action,
,,,-,878,,#¡REF!,175_PPDB,PPDB,,acute,,rat,oral,=,-,mg/kg,,#¡VALOR!,#¡VALOR!,"Contact action, eggs covered by an oil film are starved of oxygen and so do not hatch.",
,Methyl isothiocyanate (Ref: SN-32866),,CN=C=S,887,,#¡REF!,176_PPDB,PPDB,,acute,,rat,oral,=,147,mg/kg,73.1188,0.0020,2.6967,Fumigant with contact action,
,"2,4,5-trichlorophenol",,C1=C(C(=CC(=C1Cl)Cl)Cl)O,963,,#¡REF!,177_PPDB,PPDB,,acute,,rat,oral,=,820,mg/kg,197.448,0.0042,2.3816,Causes distorted growth that affects respiration and cell function,
,,,-,965,,#¡REF!,178_PPDB,PPDB,,acute,,rat,oral,=,-,mg/kg,,#¡VALOR!,#¡VALOR!,"Contact action, eggs covered by an oil film are starved of oxygen and so do not hatch.",
,Didecyldimethylammonium chloride (Ref: P0151),,CCCCCCCCCC[N+](C)(C)CCCCCCCCCC.[Cl-],988,,#¡REF!,179_PPDB,PPDB,,acute,,rat,oral,=,150,mg/kg,362.083,0.0004,3.3827,"Broad spectrum, non-systemic",
,"2,5-dichlorobenzoic acid methyl ester",,COC(=O)C1=C(C=CC(=C1)Cl)Cl,1074,,#¡REF!,186_PPDB,PPDB,,acute,,rat,oral,=,1030,mg/kg,205.04,0.0050,2.2990,Topical,
,Iminoctadine triacetate (Ref: DF 125),,CC(=O)O.CC(=O)O.CC(=O)O.C(CCCCN=C(N)N)CCCNCCCCCCCCN=C(N)N,1085,,#¡REF!,187_PPDB,PPDB,,acute,,rat,oral,=,300,mg/kg,535.728,0.0006,3.2518,Protectant. Multi-site activity.,
,Prothiocarb,,CCSC(=O)NCCCN(C)C,1112,,#¡REF!,188_PPDB,PPDB,,acute,,rat,oral,=,1300,mg/kg,190.31,0.0068,2.1655,"Lipid synthesis inhibitor, involves interference with membrane function. Slowly translocated.",
,Fenaminosulf (Ref: BAY 5027),,CN(C)C1=CC=C(C=C1)N=NS(=O)(=O)[O-].[Na+],1130,,#¡REF!,191_PPDB,PPDB,,acute,,rat,oral,=,60,mg/kg,251.241,0.0002,3.6219,Interferes with NADH-ubiquinone reductase (complex I).,
,Ipconazole (Ref: KNF 317),,CC(C)C1CCC(C1(CN2C=NC=N2)O)CC3=CC=C(C=C3)Cl,1140,,#¡REF!,193_PPDB,PPDB,,acute,,rat,oral,=,888,mg/kg,333.862,0.0027,2.5752,"Systemic, broad-spectrun, inhibits sterol synthesis in fungi.",
,Benquinox (Ref: BAY 15080),,C1=CC=C(C=C1)C(=O)NNC2=CC=C(C=C2)N=O,1188,,#¡REF!,195_PPDB,PPDB,,acute,,rat,oral,=,100,mg/kg,241.249,0.0004,3.3825,Systemic,
,Etaconazole (Ref: CGA 64251 ),,CCC1COC(O1)(CN2C=NC=N2)C3=C(C=C(C=C3)Cl)Cl,1196,,#¡REF!,196_PPDB,PPDB,,acute,,rat,oral,=,1343,mg/kg,328.198,0.0041,2.3881,Sterol biosynthesis inhibition,
,Simeconazole,,C[Si](C)(C)CC(CN1C=NC=N1)(C2=CC=C(C=C2)F)O,1204,,#¡REF!,198_PPDB,PPDB,,acute,,rat,oral,=,611,mg/kg,293.417,0.0021,2.6814,"Broad antifungal activity, systemic, absorbed by roots and translocates, sterol demethylation inhibitor",
,Edifenphos (Ref: BAY 78418),,CCOP(=O)(SC1=CC=CC=C1)SC2=CC=CC=C2,1205,,#¡REF!,199_PPDB,PPDB,,acute,,rat,oral,=,150,mg/kg,310.377,0.0005,3.3158,"Phospholipid biosynthesis inhibition, foliar applied with protective and curative action",
,Oxpoconazole fumarate (Ref: UR 50302),,CC1(COC(N1C(=O)N2C=CN=C2)(C)CCCC3=CC=C(C=C3)Cl)C.CC1(COC(N1C(=O)N2C=CN=C2)(C)CCCC3=CC=C(C=C3)Cl)C.C(=CC(=O)O)C(=O)O,1206,,#¡REF!,200_PPDB,PPDB,,acute,,rat,oral,=,1035,mg/kg,839.815,0.0012,2.9092,"Systemic, curative with residual activity, inhibits ergosterol biosynthesis",
,Iprobenfos,,CC(C)OP(=O)(OC(C)C)SCC1=CC=CC=C1,1207,,#¡REF!,201_PPDB,PPDB,,acute,,rat,oral,=,680,mg/kg,288.347,0.0024,2.6274,"Systemic, with both curative and protective properties. Absorbed through roots and translocated. Phospholipid biosynthesis inhibitor",
,Metominostrobin (Ref: SSF 126),,CNC(=O)C(=NOC)C1=CC=CC=C1OC2=CC=CC=C2,1211,,#¡REF!,205_PPDB,PPDB,,acute,,rat,oral,=,708,mg/kg,284.314,0.0025,2.6038,"Systemic with broad-spectrum curative and protectant activity, inhibits respiratory electron transfer. Respiration inhibitor (QoL fungicide).",
,Tecloftalam (Ref: SF 7402),,C1=CC(=C(C(=C1)Cl)Cl)NC(=O)C2=C(C(=C(C(=C2Cl)Cl)Cl)Cl)C(=O)O,1214,,#¡REF!,208_PPDB,PPDB,,acute,,rat,oral,=,2340,mg/kg,447.916,0.0052,2.2820,Inhibits the growth of bacteria,
,Diflumetorim (Ref: UBF 002),,CCC(C1=CC=C(C=C1)OC(F)F)NC2=NC=NC(=C2Cl)C,1216,,#¡REF!,210_PPDB,PPDB,,acute,,rat,oral,=,448,mg/kg,327.761,0.0014,2.8643,"Protectant and curative activity, inhibition of complex I NADH Oxido-reductase.",
,Flumorph (Ref: SYP L190),,COC1=C(C=C(C=C1)C(=CC(=O)N2CCOCC2)C3=CC=C(C=C3)F)OC,1217,,#¡REF!,211_PPDB,PPDB,,acute,,rat,oral,=,2710,mg/kg,371.407,0.0073,2.1369,"Systemic, displays protectant, curative and antisporulant activity, though to disturb the polar deposition of newly synthesized cell wall material",
,Methasulfocarb (Ref: NK 191),,CNC(=O)SC1=CC=C(C=C1)OS(=O)(=O)C,1218,,#¡REF!,212_PPDB,PPDB,,acute,,rat,oral,=,112,mg/kg,261.321,0.0004,3.3680,Growth retarding activity,
,Bentaluron (Ref: CGA 18734),,CC(C)NC(=O)NC1=NC2=CC=CC=C2S1,1254,,#¡REF!,215_PPDB,PPDB,,acute,,rat,oral,=,-,mg/kg,235.31,#¡VALOR!,#¡VALOR!,Unknown,
,Cyprofuram (Ref: SN 78314),,C1CC1C(=O)N(C2CCOC2=O)C3=CC(=CC=C3)Cl,1286,,#¡REF!,216_PPDB,PPDB,,acute,,rat,oral,=,174,mg/kg,279.722,0.0006,3.2062,"Systemic, inhibits zoospore release",
,Chlordecone (Ref: ENT 16391),,C1(=O)C2(C3(C4(C1(C5(C2(C3(C(C45Cl)(Cl)Cl)Cl)Cl)Cl)Cl)Cl)Cl)Cl,1293,,#¡REF!,219_PPDB,PPDB,,acute,,rat,oral,=,91.3,mg/kg,490.639,0.0002,3.7303,Central nervous system stimulant. GABA-gated chloride channel antagonist. Has stomach action and also weak contact activity,
,Talc E553B,,[Mg+2].[Mg+2].[Mg+2].[O-][Si]([O-])=O.[O-][Si]([O-])=O.[O-][Si](=O)O.[O-][Si](=O)O,1307,,#¡REF!,221_PPDB,PPDB,,acute,,rat,oral,=,920,mg/kg,379.263,0.0024,2.6152,"Inert, repellent action",
,2-phenylphenol,,C1=CC=C(C=C1)C2=CC=CC=C2O,1340,,#¡REF!,226_PPDB,PPDB,,acute,,rat,oral,=,2733,mg/kg,170.21,0.0161,1.7943,"Broad-spectrum, contact",
,Propionic acid,,CCC(=O)O,1341,,#¡REF!,227_PPDB,PPDB,,acute,,rat,oral,=,-,mg/kg,74.0786,#¡VALOR!,#¡VALOR!,Though to depress microbial growth in the gastro-intestinal tract,
,8-hydroxyquinoline,,C1=CC2=C(C(=C1)O)N=CC=C2,1354,,#¡REF!,228_PPDB,PPDB,,acute,,rat,oral,=,790,mg/kg,145.161,0.0054,2.2642,"Systemic, preventative and curative - chelates various metals required by micro-organisms for their metabolism.",
,,,-,1376,,#¡REF!,232_PPDB,PPDB,,acute,,rat,oral,=,-,mg/kg,,#¡VALOR!,#¡VALOR!,"Contact action, eggs covered by an oil film are starved of oxygen and so do not hatch.",
,Isopyrazam (Ref: SYN 520453),,CC(C)C1C2CCC1C3=C2C=CC=C3NC(=O)C4=CN(N=C4C(F)F)C,1449,,#¡REF!,235_PPDB,PPDB,,acute,,rat,oral,=,2000,mg/kg,359.419,0.0056,2.2546,"Protectant, foliar absorption, translocates, inhibits respiration and spore germination and so germ tude elongation - a succinate dehydrogenase inhibitor",
,Barium polysulphide,,[S-2].[Ba+2],1458,,#¡REF!,236_PPDB,PPDB,,acute,,rat,oral,=,375,mg/kg,169.396,0.0022,2.6549,"Phytotoxic, alkaline corrosive nature may also attack cell membranes",
,,,-,1461,,#¡REF!,237_PPDB,PPDB,,acute,,rat,oral,=,-,mg/kg,,#¡VALOR!,#¡VALOR!,"Broad spectrum, non-systemic, inhibiting fungal spores from entering the host tissues",
,Fentin chloride (Ref: HOE 2872),,C1=CC=C(C=C1)[Sn](C2=CC=CC=C2)(C3=CC=CC=C3)Cl,1477,,#¡REF!,241_PPDB,PPDB,,acute,,rat,oral,=,135,mg/kg,385.48,0.0004,3.4557,Non-systemic with predominate contact activity. Inhibitor of ATP synthase.,
,Asomate,,CN(C)C(=S)S[As](SC(=S)N(C)C)SC(=S)N(C)C,1510,,#¡REF!,243_PPDB,PPDB,,acute,,rat,oral,=,335,mg/kg,435.581,0.0008,3.1140,Protective and curative action,
,Potassium iodide,,[K+].[I-],1529,,#¡REF!,244_PPDB,PPDB,,acute,,rat,oral,=,1862,mg/kg,165.998,0.0112,1.9501,"Contact, curative action, kills spores and mycelium within 24hrs by inhibiting growth, respiration and other metabolic functions",
